question,response,model,token_count,context_window
"What is artificial intelligence?","Artificial intelligence (AI) is the simulation of human intelligence in machines that are programmed to think and learn like humans. AI systems can perform tasks such as visual perception, speech recognition, decision-making, and language translation.","gpt-4",45,8192
"How does machine learning work?","Machine learning is a subset of AI that enables systems to learn and improve from experience without being explicitly programmed. It uses algorithms to analyze data, identify patterns, and make predictions or decisions based on that analysis.","gpt-4",52,8192
"Explain neural networks","Neural networks are computing systems inspired by biological neural networks. They consist of interconnected nodes (neurons) organized in layers that process information through weighted connections, enabling pattern recognition and learning.","gpt-4",48,8192
"What is natural language processing?","Natural language processing (NLP) is a branch of AI that helps computers understand, interpret, and generate human language. It combines computational linguistics with machine learning to process text and speech.","gpt-4",44,8192
"Describe deep learning","Deep learning uses neural networks with multiple hidden layers to learn complex patterns in data. It's particularly effective for image recognition, speech processing, and natural language understanding tasks.","gpt-4",38,8192
"What are transformers in AI?","Transformers are a type of neural network architecture that uses attention mechanisms to process sequences of data. They're the foundation of modern language models like GPT and BERT, enabling better understanding of context.","gpt-4",42,8192
"How do language models generate text?","Language models generate text by predicting the next word or token based on the context of previous words. They use probability distributions learned from training data to select the most likely continuation of a sequence.","gpt-4",46,8192
"What is tokenization?","Tokenization is the process of breaking down text into smaller units called tokens. These tokens can be words, subwords, or characters, depending on the tokenizer used. It's a crucial preprocessing step for language models.","gpt-4",43,8192
"Explain attention mechanisms","Attention mechanisms allow neural networks to focus on relevant parts of the input when making predictions. They help models understand relationships between different parts of a sequence, improving performance on complex tasks.","gpt-4",41,8192
"What is fine-tuning?","Fine-tuning is the process of adapting a pre-trained model to a specific task or domain by training it further on task-specific data. This allows the model to leverage general knowledge while specializing for particular applications.","gpt-4",40,8192

